{
  "$schema": "https://json-schema.org/draft/2020-12/schema",
  "title": "Enterprise Whitebox Sample Scan Summary",
  "type": "object",
  "additionalProperties": false,
  "required": [
    "schema",
    "schema_version",
    "command",
    "profile",
    "decision",
    "score",
    "critical",
    "high",
    "evidence_package_path",
    "manifest_path",
    "status",
    "notes"
  ],
  "properties": {
    "schema": { "const": "enterprise-whitebox-sample-scan-summary" },
    "schema_version": { "const": "0.1" },
    "command": { "type": "string" },
    "profile": { "type": "string" },
    "decision": {
      "type": "string",
      "enum": ["Approved", "Conditional", "Mandatory Review", "Not Approved", "Rejected", "Unknown"]
    },
    "score": { "type": "number" },
    "critical": { "type": "integer", "minimum": 0 },
    "high": { "type": "integer", "minimum": 0 },
    "evidence_package_path": { "type": ["string", "null"] },
    "manifest_path": { "type": ["string", "null"] },
    "status": { "type": "string", "enum": ["passed", "failed", "unknown"] },
    "notes": { "type": "array", "items": { "type": "string" } }
  }
}
